{
  "schemaVersion": "1.0",
  "marketId": "macro",
  "status": "ready",
  "asOf": "2026-09-02",
  "retrievedAt": "2026-09-02T06:11:42.688060Z",
  "rows": [
    {
      "id": "macro-us2y",
      "name": "美国 2Y",
      "symbol": "US2Y",
      "status": "ready",
      "unit": "percent",
      "changeUnit": "basis_points",
      "frequency": "daily_business_day",
      "timezone": "America/New_York",
      "observationDate": "2026-09-01",
      "asOf": "2026-09-01",
      "source": "us_treasury",
      "sourceUrl": "https://home.treasury.gov/resource-center/data-chart-center/interest-rates/daily-treasury-rates.csv/2026/all?_format=csv&field_tdr_date_value=2026&page=&type=daily_treasury_yield_curve",
      "methodologyVersion": "market_detail_windows_v1",
      "qualityFlags": [],
      "close": 4.39,
      "change1d": 5.0,
      "change1w": 22.0,
      "change1m": 11.0,
      "changeQtd": 25.0,
      "changeYtd": 92.0,
      "change1y": 80.0,
      "high52w": 4.39,
      "distance52wHigh": 0.0,
      "spark30d": [
        4.25,
        4.2,
        4.18,
        4.25,
        4.19,
        4.25,
        4.22,
        4.2,
        4.15,
        4.17,
        4.19,
        4.19,
        4.19,
        4.19,
        4.24,
        4.24,
        4.17,
        4.19,
        4.2,
        4.34,
        4.34,
        4.39
      ]
    },
    {
      "id": "macro-us10y",
      "name": "美国 10Y",
      "symbol": "US10Y",
      "status": "ready",
      "unit": "percent",
      "changeUnit": "basis_points",
      "frequency": "daily_business_day",
      "timezone": "America/New_York",
      "observationDate": "2026-09-01",
      "asOf": "2026-09-01",
      "source": "us_treasury",
      "sourceUrl": "https://home.treasury.gov/resource-center/data-chart-center/interest-rates/daily-treasury-rates.csv/2026/all?_format=csv&field_tdr_date_value=2026&page=&type=daily_treasury_yield_curve",
      "methodologyVersion": "market_detail_windows_v1",
      "qualityFlags": [],
      "close": 4.79,
      "change1d": 4.0,
      "change1w": 15.0,
      "change1m": 4.0,
      "changeQtd": 35.0,
      "changeYtd": 61.0,
      "change1y": 56.0,
      "high52w": 4.79,
      "distance52wHigh": 0.0,
      "spark30d": [
        4.7,
        4.63,
        4.63,
        4.69,
        4.65,
        4.72,
        4.7,
        4.68,
        4.63,
        4.68,
        4.72,
        4.71,
        4.65,
        4.69,
        4.74,
        4.7,
        4.64,
        4.66,
        4.67,
        4.73,
        4.75,
        4.79
      ]
    },
    {
      "id": "macro-us30y",
      "name": "美国 30Y",
      "symbol": "US30Y",
      "status": "ready",
      "unit": "percent",
      "changeUnit": "basis_points",
      "frequency": "daily_business_day",
      "timezone": "America/New_York",
      "observationDate": "2026-09-01",
      "asOf": "2026-09-01",
      "source": "us_treasury",
      "sourceUrl": "https://home.treasury.gov/resource-center/data-chart-center/interest-rates/daily-treasury-rates.csv/2026/all?_format=csv&field_tdr_date_value=2026&page=&type=daily_treasury_yield_curve",
      "methodologyVersion": "market_detail_windows_v1",
      "qualityFlags": [],
      "close": 5.27,
      "change1d": 2.0,
      "change1w": 10.0,
      "change1m": 0.0,
      "changeQtd": 36.0,
      "changeYtd": 43.0,
      "change1y": 35.0,
      "high52w": 5.31,
      "distance52wHigh": -0.7532956685499058,
      "spark30d": [
        5.23,
        5.18,
        5.17,
        5.22,
        5.19,
        5.25,
        5.24,
        5.24,
        5.21,
        5.25,
        5.31,
        5.28,
        5.19,
        5.23,
        5.27,
        5.23,
        5.17,
        5.18,
        5.19,
        5.22,
        5.25,
        5.27
      ]
    },
    {
      "id": "macro-netliq",
      "name": "美元净流动性",
      "symbol": "NETLIQ",
      "status": "ready",
      "unit": "usd_million",
      "changeUnit": "absolute",
      "frequency": "weekly",
      "timezone": "America/New_York",
      "observationDate": "2026-08-26",
      "asOf": "2026-08-26",
      "source": "fred",
      "sourceUrl": "https://fred.stlouisfed.org/",
      "methodologyVersion": "market_detail_windows_v1",
      "qualityFlags": [],
      "close": 5770775.0,
      "change1d": null,
      "change1w": -38201.0,
      "change1m": -140810.0,
      "changeQtd": -58491.0,
      "changeYtd": 109003.0,
      "change1y": -286578.0,
      "high52w": 5996615.0,
      "distance52wHigh": -3.766124722030679,
      "spark30d": [
        5765172.0,
        5817592.0,
        5799825.0,
        5808976.0,
        5770775.0
      ]
    },
    {
      "id": "macro-m2sl",
      "name": "美国 M2",
      "symbol": "M2SL",
      "status": "ready",
      "unit": "usd_billion",
      "changeUnit": "absolute",
      "frequency": "monthly",
      "timezone": "America/New_York",
      "observationDate": "2026-07-01",
      "asOf": "2026-07-01",
      "source": "fred",
      "sourceUrl": "https://fred.stlouisfed.org/graph/fredgraph.csv?id=M2SL&cosd=2014-09-01",
      "methodologyVersion": "market_detail_windows_v1",
      "qualityFlags": [],
      "close": 23218.0,
      "change1d": null,
      "change1w": null,
      "change1m": 102.8,
      "changeQtd": 102.8,
      "changeYtd": 862.7,
      "change1y": 1192.5,
      "high52w": 23218.0,
      "distance52wHigh": 0.0,
      "spark30d": [
        23218.0
      ]
    },
    {
      "id": "macro-walcl",
      "name": "美联储总资产",
      "symbol": "WALCL",
      "status": "ready",
      "unit": "usd_million",
      "changeUnit": "absolute",
      "frequency": "weekly",
      "timezone": "America/New_York",
      "observationDate": "2026-08-26",
      "asOf": "2026-08-26",
      "source": "fred",
      "sourceUrl": "https://fred.stlouisfed.org/graph/fredgraph.csv?id=WALCL&cosd=2014-09-01",
      "methodologyVersion": "market_detail_windows_v1",
      "qualityFlags": [],
      "close": 6730912.0,
      "change1d": null,
      "change1w": -14787.0,
      "change1m": -16466.0,
      "changeQtd": -4733.0,
      "changeYtd": 90294.0,
      "change1y": 112497.0,
      "high52w": 6759955.0,
      "distance52wHigh": -0.42963303749803067,
      "spark30d": [
        6738190.0,
        6748567.0,
        6759955.0,
        6745699.0,
        6730912.0
      ]
    },
    {
      "id": "macro-wdtgal",
      "name": "TGA 余额",
      "symbol": "WDTGAL",
      "status": "ready",
      "unit": "usd_million",
      "changeUnit": "absolute",
      "frequency": "weekly",
      "timezone": "America/New_York",
      "observationDate": "2026-08-26",
      "asOf": "2026-08-26",
      "source": "fred",
      "sourceUrl": "https://fred.stlouisfed.org/graph/fredgraph.csv?id=WDTGAL&cosd=2014-09-01",
      "methodologyVersion": "market_detail_windows_v1",
      "qualityFlags": [],
      "close": 959435.0,
      "change1d": null,
      "change1w": 23029.0,
      "change1m": 124018.0,
      "changeQtd": 57590.0,
      "changeYtd": 86582.0,
      "change1y": 433372.0,
      "high52w": 1007172.0,
      "distance52wHigh": -4.739706822667826,
      "spark30d": [
        970442.0,
        929325.0,
        959405.0,
        936406.0,
        959435.0
      ]
    },
    {
      "id": "macro-rrp",
      "name": "逆回购余额",
      "symbol": "RRPONTSYD",
      "status": "ready",
      "unit": "usd_billion",
      "changeUnit": "absolute",
      "frequency": "daily_business_day",
      "timezone": "America/New_York",
      "observationDate": "2026-09-01",
      "asOf": "2026-09-01",
      "source": "fred",
      "sourceUrl": "https://fred.stlouisfed.org/graph/fredgraph.csv?id=RRPONTSYD&cosd=2014-09-01",
      "methodologyVersion": "market_detail_windows_v1",
      "qualityFlags": [],
      "close": 0.725,
      "change1d": -6.001,
      "change1w": 0.32,
      "change1m": -1.426,
      "changeQtd": -26.175,
      "changeYtd": -105.268,
      "change1y": -77.173,
      "high52w": 105.993,
      "distance52wHigh": -99.31599256554678,
      "spark30d": [
        2.127,
        2.251,
        1.65,
        1.429,
        1.45,
        0.975,
        1.25,
        0.725,
        0.45,
        0.25,
        0.255,
        0.155,
        0.317,
        0.225,
        0.2,
        0.38,
        0.405,
        0.702,
        0.456,
        0.175,
        6.726,
        0.725
      ]
    },
    {
      "id": "macro-dff",
      "name": "联邦基金利率",
      "symbol": "DFF",
      "status": "ready",
      "unit": "percent",
      "changeUnit": "basis_points",
      "frequency": "daily",
      "timezone": "America/New_York",
      "observationDate": "2026-08-31",
      "asOf": "2026-08-31",
      "source": "fred",
      "sourceUrl": "https://fred.stlouisfed.org/graph/fredgraph.csv?id=DFF&cosd=2014-09-01",
      "methodologyVersion": "market_detail_windows_v1",
      "qualityFlags": [],
      "close": 3.63,
      "change1d": 0.0,
      "change1w": 0.0,
      "change1m": 0.0,
      "changeQtd": 0.0,
      "changeYtd": -1.0,
      "change1y": -70.0,
      "high52w": 4.33,
      "distance52wHigh": -16.166281755196305,
      "spark30d": [
        3.63,
        3.63,
        3.63,
        3.63,
        3.63,
        3.63,
        3.63,
        3.63,
        3.63,
        3.63,
        3.63,
        3.63,
        3.63,
        3.63,
        3.63,
        3.63,
        3.63,
        3.63,
        3.63,
        3.63,
        3.63,
        3.63,
        3.63,
        3.63,
        3.63,
        3.63,
        3.63,
        3.63,
        3.63,
        3.63
      ]
    },
    {
      "id": "macro-sofr",
      "name": "SOFR",
      "symbol": "SOFR",
      "status": "ready",
      "unit": "percent",
      "changeUnit": "basis_points",
      "frequency": "daily_business_day",
      "timezone": "America/New_York",
      "observationDate": "2026-08-31",
      "asOf": "2026-08-31",
      "source": "fred",
      "sourceUrl": "https://fred.stlouisfed.org/graph/fredgraph.csv?id=SOFR&cosd=2014-09-01",
      "methodologyVersion": "market_detail_windows_v1",
      "qualityFlags": [],